{
    "$schema": "http://json-schema.org/draft-07/schema#",
    "$id": "http://json-schema.org/draft-07/schema#",
    "title" : "State Set JSON schema definition",
    "description" : "This scheme defines how a state set should be defined.",
    "schema_version" : 1.0,

    "definitions" : {
        "output_state_ts_defn" : {
            "type" : "object",
             "properties" : {
                 "metric" : { "type" : "string" },
                 "tags" : { "type" : "object", "properties": {"state_label" : {"enum" : ["PLACEHOLDER"]}}, "required" : ["state_label"]}
              },
              "required" : ["metric", "tags"]
        },
         "ts_leaf_defn" : {
             "type" : "object",
             "properties" : {
                 "metric" : { "type" : "string" },
                 "tags" : { "type" : "object" }
              },
              "required" : ["metric", "tags"]
         },

        "fq_timeseries" : {
            "type" : "object",
            "properties" : {
                "ts_name" : { "type" : "string"},
                "ts_defn" : {
                    "$ref" : "#/definitions/ts_leaf_defn"
                }
            },
            "required" : ["ts_name", "ts_defn"]
        },

        "statement" : {
            "type" : "array",
            "items" : [
                { "type" : "string" },
                { "type" : "string",
                  "enum" : ["<", ">", "==", "<=", ">="] },
                {
                    "anyOf": [
                        { "type" : "number" },
                        { "type" : "integer" }
                    ]
                }
            ]
        },

        "state_defn" : {
            "type" : "object",
            "properties" : {
                "label" : { "type" : "string" },
                "expression" : {
                    "type" : "array",
                    "items": {
                        "$ref" : "#/definitions/statement"
                    }
                },
                "expression_operator" : { "const": "AND"}
            }
        }
    },

    "type" : "object",
    "properties" : {
        "name" : { "type" : "string" },
        "uuid" : { "type" : "string" },
        "state_definitions" : {
            "type" : "array",
            "items": {
                "$ref" : "#/definitions/state_defn"
            }
        },
	"query_params" : {
            "type" : "object",
	    "properties" : {
	        "msec_response" : {
                    "type" : "boolean",
	            "default": false
		}
	    },
            "required" : ["msec_response"]
	},
        "input_timeseries" : {
            "type" : "array",
            "items": {
                "$ref" : "#/definitions/fq_timeseries"
            }
        },
        "output_timeseries_template" : {
            "type" : "object",
            "$ref" : "#/definitions/output_state_ts_defn"
        }
    },
    "required" : ["name", "uuid", "state_definitions", "input_timeseries", "output_timeseries_template"]
}
