{
        "name": "extruder_states",
        "uuid": "xxxxxxxxxxxxxxx",
        "state_definitions" : [
            {
               "label" : "TestStateV1_ON_Producing",
               "expression" : [
                 ["machine_power", "==", 1],
                 ["melt_temperature", ">=", 115]
               ],
               "expression_operator" : "AND"
            },
            {
               "label" : "TestStateV1_ON_Overhead",
               "expression" : [
                 ["machine_power", "==", 1],
                 ["melt_temperature", "<", 115]
               ],
               "expression_operator" : "AND"
            },
            {
               "label" : "TestStateV1_MachineOFF",
               "expression" : [
                 ["machine_power", "<", 1],
                 ["melt_temperature", "<=", 200]
               ],
               "expression_operator" : "AND"
            }
        ],
        "input_timeseries" : [
            {
                "ts_name" : "melt_temperature",
                "ts_defn" : {
                    "metric": "machine.sensor.melt_temperature",
                    "tags" : {
		               "machine_type": "EXTRUDER",
			       "unit": "deg_C",
			       "shift_id": "1",
			       "port_num": "1",
			       "industry": "WIRE_AND_CABLE_MANUFACTURING",
			       "machine_name" : "90mm_extruder"
		             }
                }
            },
                      {
                "ts_name" : "machine_power",
                "ts_defn" : {
                    "metric": "machine.sensor.machine_powerOn_state",
                    "tags" : {
		               "machine_type": "EXTRUDER",
			       "unit": "Binary",
			       "shift_id": "1",
			       "port_num": "5",
			       "industry": "WIRE_AND_CABLE_MANUFACTURING",
			       "machine_name" : "90mm_extruder"
		             }
                }
            }
        ],
        "output_timeseries_template" : {
            "metric" : "quilt.test_state_v1",
            "tags" : { "machine" : "90mm_extruder", "state_label" : "PLACEHOLDER" }
        }
}
